,0
0,"Gewissheit um letzten Willen
                  


        
        Nationales Register für Organspende lanciert"
1,Charles Aznavour ist tot
2,CEO von Juventus geht – Gerüchte um Zidane mehren sich
3,Roman Bürki: Vom Risikofaktor zum Bollwerk
4,"Slapstick, Sixpack, Sonntagsschuss!"
5,Weshalb wurden die Menschen von der Welle überrascht?
6,Über 1200 Tote befürchtet
7,Die grosse Vorfreude auf die «Menschenwand»
8,Traumlos für FCZ-Frauen
9,Italien kandidiert nun doch für 2026
10,Mit diesen Tipps wirst du Pilzsammler-Pro
11,Augen auf beim Pilze sammeln
12,"«The Cleaners»: Diese Billigarbeiter löschen Folter, Sex und Mord"
13,Max Hubacher über seine Rolle als psychisch Kranker
14,Wie der Heisshunger der Amerikaner die Donuts löcherte
15,Wieviel Gentechnik steckt in unserem Essen?
16,Fast Food erster Güte: French Toast mit Etivaz
17,Digitale Entgiftung wird uns nicht heilen
18,Legt das Handy weg!
19,"Lass dich drücken, Dummerchen"
20,Mit Ursula Brunner bekam das Elend am Platzspitz ein Gesicht
21,Zürich Junkietown
22,Grand Tour der Schweiz: Von Zürich ins Berner Oberland
23,Grand Tour der Schweiz: Vom Jura bis ins Wallis
24,Vor 50 Jahren wurde das Schweizer Fernsehen farbig
25,Es werde Farbe! – 50 Jahre Farbfernsehen
26,Von diesem Georgier kriege ich den Flattermann
27,Wegen «Marlène» bleibt Philippe Djian Kult für mich!
28,"Wettbewerb ""Die ideale Sekretärin"" (1969)"
29,Touristen reisen durch die Schweiz in zwei Tagen (1970)
30,Feriensportlager in Fiesch (1987)
31,Wie sieht Ihr Service public aus?
32,Die höchste Dreiseilbahn der Welt ist eröffnet
33,Lugano trotzt dem FC Basel einen Punkt ab
34,Donald Trump macht eine Liebeserklärung
35,"Tagesschau vom 30.09.2018, 19:30"
36,Die Zahl der Opfer steigt
